title,openTypeList,detail
敬亭绿茶,绿茶##茶叶##茶学##茶文化##茶的种类,敬亭绿雪产于安徽省宣州市北敬亭山。敬亭绿雪形似雀舌，挺直饱润，色泽嫩绿，白毫显露，嫩香持久，回味甘醇。分为一、二、三共四个等级。饮评者有诗赞誉:形似雀舌露白毫，翠绿匀嫩香气高，滋味醇和沁肺腑，沸泉明瓷雪花飘。
泾渭茯茶,生活##茶叶##茶学,茯茶属六大茶类中的黑茶中特色产品，是后发酵茶，也是全发酵茶。原本是西北，哈萨克，蒙古等游牧民族地区特需商品。因在伏天加工，故称伏茶。以其效用类似土茯苓，美称为茯茶、福砖。由于系用官引制造，交给官府销售，又叫官茶、府茶。
骆耀平,教授##茶叶##茶学##茶文化,骆耀平，男，是一名教授，浙江省茶叶学会理事。
李瑞河,人物##企业家##台湾##经济人物##茶叶##茶学,"李瑞河，天福集团总裁,被誉为“世界茶王”、“两岸茶王”，现代中国茶文化创始者。1935年12月10日出生于台湾省南投植茶世家，祖籍福建漳浦。一九五三年创立台湾天仁集团，一九九三年，赴大陆开拓天福集团，培育了天仁茗茶、天福茗茶两大世界知名品牌，其中，天仁茗茶现为两岸首家茶业股票上市公司。而大陆的天福集团现有9家生产工厂，715家直营连锁店，还建立了位于漳州的全球最大茶博物院、位于福建厦（厦门）汕（汕头）高速公路天福服务区的全球最大高速公路服务区，还有位于四川的天福茶博物院第一分馆。此外，李瑞河创办的天福茶学院为全球首家茶专业院校。2000年，人民日报《时代潮》将其列为“时代人物”——世界茶王。由漳州市有关方面主持编纂的《漳州百年百杰》传记册中，李瑞河同张克辉、连战、连横等一同入选。"
手筑茯砖,茶学##茶文化##黑茶,手筑茯砖茶是安化黑茶的一种，因其经手工筑成砖形而得名。手筑茯砖茶内金花满布，花香饱满，汤色红亮，滋味醇和，具有祛油脂，助消化清肠道之作用，其品质优于一般茯砖。
灵岩茶,茶##茶学##茶文化,灵岩茶，因产自山东灵岩寺而得名。灵岩茶种植因纬度高、气温较低、昼夜温差大，鲜叶中叶绿素、蛋白质、多酚类物质含量高，干茶色泽、汤色和叶底均绿亮、品质好，灵岩茶具有叶片厚、滋味浓、耐冲泡的特点，被誉为“泉城第一茶”，有诗云“泉城水灵岩茶，相映生辉甲天下”。在第八届中国国际农产品交易会上，灵岩绿茶荣获金奖。  创始人/灵岩茶 编辑 			 		灵岩茶创始人为济南种茶创始人山东立泰山茶业科技开发有限公司董事长董庆国先生，董庆国先生曾荣获“山东省新农村建设突出贡献人物”、“山东茶叶行业十佳优秀企业家”、“山东省百名创业之星”、“济南市实用人才”、“南茶北引功勋茶人”等荣誉称号，入编《长清县志》、《济南年鉴（2004）》、《济南年鉴（2007）》。  历史渊源/灵岩茶 编辑 			 		据历史记载，茶道、茶文化始于灵岩寺。茶原产于四川、云南。公元前3世纪秦灭蜀国，此后茶树自四川移植关中、中原、江淮等地。饮茶约始于秦汉时期，当时是以茶为药。 山东地区较大规模茶树种植是从唐朝开始的，中唐时期的著作《封氏闻见记》卷六记载：“开元中，泰山灵岩寺有降魔师大兴禅教，学禅务于不寐，又不夕食，皆许其饮茶，人自怀挟，到处煮饮。从此转相仿效，遂成风俗，自邹、齐、沧、棣，渐至京邑，城市多开店铺，煎茶卖之，不问道俗，投钱取饮。其茶自江淮而来，舟车相继，所在山积，色额甚多。楚人陆鸿渐为《茶论》说茶之功效，并煎茶、炙茶之法，造茶具二十四事，以都统笼贮之，远近倾目，好事者家藏一副。有常伯熊者，又因鸿渐之《茶论》广润色之，于是茶道大兴，王宫朝市无不饮者。”这是关于饮茶之风形成过程的最早、最系统的记录，它明确地指出：茶道、茶文化始于灵岩寺。 灵岩寺始建于公元351年东晋时期，到了唐代灵岩寺与浙江天台山国清寺、南京栖霞寺和湖北江陵玉皇寺并称为全国四大名刹，成为黄河流域最负盛名的佛教圣地。隋唐朝代的皇帝们封禅泰山时几乎都要在灵岩寺“驻跸”几天。灵岩寺因拥有众多的田产，所以附近的六律庄、第四峪、小寺、野老庄、花岩寺的农家大多是寺院的佃户，因此灵岩寺的僧人及其佃户种茶供寺院饮用，具备了天时、地利、人和的各种条件。 灵岩茶历史渊源相关图片 灵岩茶历史渊源相关图片 (2张) 到了晚唐时期，继续向北延伸，五莲、胶南、泰安、济南长清灵岩寺一带陆续有了茶园，灵岩寺内有碑刻：“身在净土上方界，闲观野鸟鸣幽谷，顿觉超俗话新茶，再整衣冠拜佛牙……”中的“新茶”即为“长清灵岩茶”。后因北方气候严寒、战乱等原因，灵岩寺一带的茶树种植历史不具规模。直到2003年7月，董庆国终于种出济南市第一片40亩地的有机茶园，恢复了济南中断了千余年的种茶史。  主要产地/灵岩茶 编辑 			 		灵岩茶主要产自山东长清灵岩寺一带，长清灵岩茶种植基地现有茶园面积3000亩，东至济南市长清区万德镇拔山村，西至双泉镇大张庄，南至万德镇马套村，北至五峰山街道办事处石窝村，辖5个乡镇(办事处)32个行政村。  产地环境/灵岩茶 编辑 			 		济南市长清区属温带大陆性半湿润季风气候，与同纬度的内陆相比，具有气候温和、温差较小、雨水丰沛、光照充足、无霜期长的特点。年平均日照射数为2598.5小时，年平均气温11.3℃，年无霜期215天。茶树不耐低温，大多数茶树品种安全越冬要求温度不低于-10℃，但有些品种如浙江鸠坑茶、安徽黄山茶等，可忍受-15℃左右的低温。冬季采用覆盖塑料拱棚、保护地栽培等措施，基本解决了茶树的越冬问题。 长清区土壤从区境东南到西北依次分布着棕壤、褐土、潮土和风沙土。其中棕壤土发育在酸性岩上，呈微酸性反应，分布于万德镇和双泉镇、马山镇南部及泰安、肥城接壤的地方，五峰镇和张夏镇亦有小量棕壤分布，可利用面积36.5万亩。土层深厚，呈微酸性反应，土壤有机质含量高，富含锌、铁、硼、钙、镁、钼等中微量元素，这些都为茶叶营养成分优质化提供了有利条件。 长清区年平均降水量628.2mm，地下水源充足，水质清澈，无污染，水利条件配套齐全，农田排灌设施配套，达到了旱能浇、涝能排。灌溉用水含总铅、总镉、总汞、总砷、铬、钠、氟化物、氰化物、氯化物、PH值均符合国家灌溉水质标准，适合大面积灌溉。 茶树生长在北方，休眠期长，昼夜温差大，降雨相对减少，生长速度减慢，叶片肥厚，贮藏养分丰富。同时，北方栽培茶叶历史相对较短，病虫害发生相对较轻，农药使用量少或者不使用。因此，北方生产出的茶叶具有耐冲泡、滋味浓、香味独特等南方茶叶所不具备的特有的品质。  发展历程/灵岩茶 编辑 			 		千百年来，济南人饮的茶，无论绿茶还是花茶，都是南运而来，即使提起山东的茶叶，人们首先想到的是日照茶、崂山茶。但最终有一个人改写了当代济南“饮茶不产茶”的历史，建成了长江以北最大的有机茶园，这个人即为山东立泰山茶业科技开发有限公司董事长、“南茶北引”功勋茶人董庆国先生。 据济南市农业局调查，在1999年之前，济南境内没有一棵茶树。董庆国坚信，只要对土壤进行改造，并选择气候更适宜的土地，济南同样也能种茶。通过查阅1992年版《长清县志》了解到在长清区万德镇和双泉乡、马山乡南部与泰安、肥城接壤的地方，土壤为棕壤土，呈微弱酸性反应，适宜发展茶树种植。1999年春天，董庆国选择一块荒地作为茶园试验田，茶园没有水，就自己上变压器；土地荒芜，就进行土壤改造。建设过程中，先后动用100余人、30多辆车，将几千吨砂土、几百吨有机肥运往茶园，共投资200多万元，建设高标准有机茶园。济南没有现成的种茶成功经验可供借鉴，他就搜集大量种茶技术书籍，并聘请山东农业大学张丽霞博士、安徽农业大学詹罗九教授等国内知名专家亲临茶园指导，从土壤改造、园地规划，到茶树平衡营养施肥、茶叶加工工艺及成品茶包装储藏，一切都严格按照有机优质茶叶生产技术规程操作，建立完整的茶园配套设施。 1999年起，董庆国逐步进行试验性、小面积种植，2003年7月，终于种出济南市第一片40亩地的有机茶园，济南长清成为山东“南茶北引”北方成功种植纬度最高的区域之一。茶园面积虽微，却标志着长清区的茶园恢复了济南中断了千余年的种茶史。“趵突泉水甲天下，泉城更有灵岩茶”，灵岩茶园之茶树引“五步三泉”之水浇灌，取名灵岩绿茶，此茶精选一芽一叶精心炒制，色绿香高。由此也形成了南有“虎跑泉、西湖龙井”，北有“趵突泉、灵岩茗茶”的格局，成为当代茶中双绝。 在总结失败教训、成功经验的基础上，在济南市农业局、财政局、发改委、各级科协、长清区农业局、农业综合开发办公室等有关部门的大力支持下，经过不断的生产技术改进和品种改良，长清灵岩茶逐步形成了耐严寒、病虫害较少、宜管理的特点。长清灵岩茶种植因纬度高、气温较低、昼夜温差大，鲜叶中叶绿素、蛋白质、多酚类物质含量高，干茶色泽、汤色和叶底均绿亮、品质好。在第八届中国国际农产品交易会上，“长清灵岩茶”在众多茶叶品牌中脱颖而出，荣获金奖。近年来，济南市长清区委、区政府高度重视茶产业发展，把“发展茶产业，带动农民增收致富”列入长清区“十二五规划”，着力提高长清灵岩茶竞争力，推动茶产业的可持续快速发展。  灵岩茶的类别/灵岩茶 编辑 			 		灵岩茶，又名长清灵岩茶，分绿茶与红茶两个类别，即灵岩有机绿茶（灵岩绿）、灵岩有机红茶（灵岩红）。  灵岩茶特点及冲泡/灵岩茶 编辑 			 		灵岩绿茶的特点 长清灵岩茶因种植纬度高、气温较低、昼夜温差大，鲜叶中叶绿素、蛋白质、多酚类物质含量高，干茶色泽、汤色和叶底均绿亮、品质好；灵岩绿茶精选新鲜、匀净的鲜叶，经现代先进加工工艺精制而成，该茶外形挺直，条紧显毫、色泽绿翠光润，香气浓郁而持久，滋味甘醇且鲜爽，汤色嫩绿明亮，叶底翠绿肥壮。概括而言，灵岩绿茶叶片肥厚、茶叶香气高、滋味浓郁、耐冲泡、汤色嫩绿明亮，并带有独特的板栗香。 灵岩绿茶的冲泡 灵岩有机绿茶与水的比例大致为1：65，即每杯用3克左右茶叶，须200毫升80－85℃的开水（山泉水最佳）冲泡。向杯中划圆弧的注水少许，用以滋润茶芽，芽叶的身姿已经开始缓缓伸展，阵阵幽香恰也透过水雾而来，别有一番春回大地万物生的遐想。灵岩有机绿茶浓郁扑鼻的煮板栗香，并且经过高冲水后毫毛激荡回落了下来，汤色清澈明亮，茶芽峰苗朵朵秀立于杯中，仿佛让人感受到了雪雾天晴、松柏苍翠、深幽清新的灵岩美景。 灵岩红茶的特点 灵岩红茶是立泰山茶叶有限公司高级炒茶技师最新研发的功夫红茶。灵岩红茶原料细嫩，经萎凋、揉捻、干燥等典型工艺过程，外形条索紧直、匀齐、色泽乌润、香气浓郁、滋味醇甜而甘浓，汤色、叶底红艳明亮，具有独特的天然玫瑰花香，具有形质兼优的品质特征。 灵岩红茶的冲泡 第一步，将新鲜的冷水注入煮水壶里煮沸：水龙头流出来的水饱含了空气，可以将灵岩红茶的香气充分导引出来，隔夜的水、二度煮沸的水或保温瓶内的热水，都不适合来冲泡灵岩红茶。第二步，注入正滚沸的开水：以渐歇的方式温壶和杯，避免水温变化太大。第三步，投茶：冲泡浓茶，每人一茶匙的量(约2.5g的茶叶)，冲泡淡茶则适当减少茶叶量。第四步，将滚水注入壶里。可依个人喜好，在里面加入糖或牛奶，这样涩味会减低而且口感也变的丰富一些。 所获荣誉编辑 有机绿茶就是采用“有机种植法”种植茶树，其产品经检测符合国家有机食品标准的茶叶。有机茶是绿色食品饮料，具有清热去腻、降压抗癌、防止心血管疾病、延年益寿等保健作用。董庆国主持研制的灵岩绿茶，已通过中国有机产品和QS食品安全质量认证，具有叶片厚、滋味浓、耐冲泡的特点，被誉为“泉城第一茶”；新研制的有机红茶“灵岩红”，形似菊，香如兰，味若莲，被誉为“北茶之巾帼”。 2009年10月，灵岩绿茶被评定为中华人民共和国第十一届运动会指定绿茶； 2010年10月，灵岩绿茶荣获第八届中国国际农产品交易会金奖； 2011年1月，灵岩绿茶被评为“十大农产品品牌”百花奖； 2011年9月，灵岩绿茶被评为最受欢迎的济南品牌农产品； 2011年10月，灵岩牌茶叶被认定为济南名牌； 2011年10月，灵岩绿茶被评定为山东大众放心茶； 2011年10月，灵岩红茶荣获首届山东红茶交流评比二等奖。
黄练芽茶,茶##茶叶##茶学##茶的种类,黄练芽茶，其茶采自野生乔木黄练芽树，经几十道工序加工而成，具有清热解毒、解暑明目、生津止渴、解腻、降血脂、治痧症、痢疾、咽喉肿痛症等功效，其味不仅具有一般的茶香，而且药香浓郁实乃珍贵稀有的保健凉茶品。黄练芽茶在中国主要产地：湖南省醴陵市官庄乡小阳坑村。
江西省婺源茶叶学校,学校##教育##教育机构##机构##社会##社会组织##组织##茶学##茶文化,江西省婺源茶叶学校（上饶职业技术学院婺源校区）座落于中国最美乡村——婺源。学校源于1939年创办的江西省立婺源制茶科初级应用职业学校，1973年更名为江西省婺源茶叶学校，2005年成立了上饶职业技术学院婺源分院。学校教学设施齐全，专业教室先进，师资力量雄厚。学校顺应市场经济发展趋势，在继续发挥传统专业特色的基础上，增设新专业。加强实践教学，注重技能培养是茶校的教学特色。
《神州问茶》,书籍##出版##出版业##出版物##图书##文化##茶学##茶文化##茶道,《神州问茶》是林治所写，由人民文学出版社于2002年11月1日出版。
吴锡端,茶叶##茶学##茶文化,"吴锡端，男，毕业于安徽农业大学茶学系。曾在商业部土特产品管理司茶叶处、中国农副产品开发公司工作，现任中国茶叶流通协会秘书长,茶叶市场专业委员会主任委员。"
王登良,人物##农业##茶学,王登良，男，1954年12月出生。现任华南农业大学茶叶科学系主任，院学术、学位委员会委员，广东省茶叶协会理事，广州茶文化促进会理事，广东省农作物品种审定委员会茶叶品审专家，《中国茶叶》编委。2000年12月任茶学硕士点首席专家。
显毫,术语##茶叶##茶学##词语,显毫是茶叶感官审评术语，是指茶叶茸毛含量特别多。
云南农业大学龙润普洱茶学院,教育##社会##茶学##茶学文献,云南农业大学龙润普洱茶学院的前身是建于1972年的茶学专业。茶学是一门具有悠久历史和特色鲜明的传统学科，亦是一门涉及自然科学和人文科学的现代学科。茶叶既是云南的传统支柱产业，也是数百万山区农民的主要经济来源和地方财政的主要税源。为了适应云南茶产业的发展，做强、做优普洱茶，经有关部门批准，云南普洱茶研究院、国家普洱茶认证中心也相继成立，其不仅对云南茶产业跨越式的发展产生重要作用，同时也为学院的人才培养起到积极的推动作用。
王国鉴,人物##茶叶##茶学##茶文化,王国鉴 男，1937年6月生，福建省福州市人。1959年12月北京农业大学农学毕业。1987年获高级农艺师资格。曾任三明市经济作物局、农业局茶叶站站长。现任福建省茶叶学会常务理事。长期从事农业工作，曾工作过东北垦区与基层试验站，在茶叶技术推广工作中，结合当地实际，对普及茶树良种、改变当地单一茶类，开展名优茶生产、普及、提高生产、加工技术、提高茶叶集约化经营与总体水平做出的成效。
唐明熙,书法##人物##绘画##茶学,唐明熙（1944年1月25日～2011年8月24日），号黄山山人，男，安徽歙县人，茶学专科及大学数学学历，中国著名茶学家、书画家、诗人，中国茶学会会员，中国作物种质资源高级专家。
明清茶文化,历史##文化##茶##茶学,明清时期，中国茶业出现了较大的变化，唐宋茶业的辉煌，主要是表现在茶学的深入及茶叶加工，特别是贡茶，加工技术技术的精深。而明清时期，这种传统的茶学、茶业及至茶文化，因为经过宋元的社会动荡，而发生了很大的变化，也形成了自己的特色。
铜陵野雀舌,名茶##安徽##茶叶##茶学##铜陵,铜陵野雀舌茶简称野雀舌，为历史名茶，属绿茶类。乾隆饮后誉为“江南佳茗”。
原叶茯茶,茶学##茶文化##黑茶,原叶茯茶，属安化黑茶中的茯砖茶产品，精选安化云台山野生茶树原料，在制作过程中改革原有“切碎”工艺，完整保留了茶叶叶片原生态的外形，并将现代技术与传统“炭火烘焙提香”工艺结合精制而成。该茶获第七届中国国际茶业博览会金奖。
云铜普洱茶,普洱茶##茶叶##茶学,普洱茶是云南独有大叶种茶树所产的茶。而云铜普洱生茶采用于临沧自然生态原始森林中的古树乔木茶，以大叶种晒青毛茶为原料，精工细作而成。 云铜普洱茶条索紧结，显毫，茶汤金黄明亮，香气浓郁，滋味纯正，茶气足，滋味醇厚生津，具有越陈越香的特点。乃是茶中之佳品，饮品中之精品，收藏之极品
叶乃兴,茶叶##茶学##茶文化,叶乃兴，男，教授，研究员，1963年7月出生，福建寿宁县人，硕士生导师。现任福建农林大学园艺学院茶学系主任，福建农林大学茶叶科技与经济研究所常务副所长，福建省科技厅科技特派员。
杨贤强,茶##茶叶##茶学,杨贤强(1939年－)，男，1957年从越南回国，1964年毕业于浙江农业大学茶学系，1981年获农学硕士学位。现为浙江大学茶学系教授、博士生导师。全国高等农业院校教学委员会委员，浙江省茶叶学会理事，浙江省第七、八届政协委员，致公党浙江省委常委，浙江省侨联常委。
野尖茯砖黑茶,茶学##茶文化##黑茶,野尖茯砖黑茶产地为湖南，又名湖茶，产出时间1644年前后。
源茗茶,绿茶##茶叶##茶学##茶文化##茶艺,源茗茶，属绿茶类珍品之一，因其条索纤细如士女之秀眉而得名。产于江西省婺源县。外形壮实，条索匀直，白毫满披，色泽绿润，香高持久，滋味鲜浓，汤色明亮，叶底嫩绿，品质极佳，为绿茶珍品。
醉茶综合征,健康##生活##茶学##茶文化,新茶不可急于饮用，更不能多饮，存放1个月后喝才健康。如果新茶在制成后储存时间不足1个月，其中的茶多酚、醇类、醛类含量较高，不利于人体健康。特别是茶多酚含量最高的新绿茶，对人体的胃肠黏膜有较强的刺激作用。胃肠功能差者喝了以后容易引起腹痛便秘、口燥咽干等不适症状。患有慢性胃炎者，喝新茶会引起胃痛、腹胀等症状。频饮多饮新茶，会出现头晕失眠、四肢无力、胃痛腹胀、便秘等不良反应，称之为“醉茶综合征”。
张其生,人物##学者##茶学##茶文化##贵州,张其生，毕业于安徽农学院，是一位贵州高原资深的茶叶和茶文史专家。
