title,openTypeList,detail
中国名泉,茶学,基本信息/中国名泉 编辑 			 		　　书名： 中国名泉 作者： 胡素敏　卢金凯　朱光建  　　字数(千字)： 书号： 7-116-01010－6  　　页数： 150 出版日期： 1992-6  　　开本： 8开 出版物类别： 地质矿产  　　版次印次： 1992年6月第一版 出版社： 地质出版社  　　装帧： 精装  内容简介/中国名泉 编辑 			 		　　《中国名泉》画册，取材广、代表性强，采用图片与文字相结合的方法，对每个名泉的地质与水化学特征以及历史、传说与现状作了简要介绍；根据各名泉的地质、水文地质特征、成名原因及社会影响，经过综合对比分析，首次对名泉进行了分类尝试，为泉的研究、评价提供了初步的理论依据。画册内容丰富，图文并茂，是我国名泉的第一部集锦和珍贵档案。它对于系统了解我国各类名泉的概况、普及地学知识，提高人民群众的环境保护意识，以及宣传我国的大好河山和文明历史、激发人们对祖国山河的热爱、增强民族自豪感，进行爱国主义教育，都必将产生积极的影响；此外，对于开展国际地质科技交流和发展旅游事业，也会显示出重要的实用价值。  图书目录/中国名泉 编辑 			 		　　前言…………………………………………………(1) 　　中国名泉的类型、分布及特征……………………(3) 　　中国名泉……………………………………………(7) 　　中国名泉分布略图…………………………………(8) 　　1．小汤山温泉……………………………………(10) 　　2．热河泉…………………………………………(12) 　　3．汤泉……………………………………………(16) 　　4．赤城温泉………………………………………(18) 　　5．晋祠泉…………………………………………(20) 　　6．娘子关泉………………………………………(24) 　　7．广胜寺泉………………………………………(28) 　　8．阿尔山矿泉……………………………………(32) 　　9．克旗温泉………………………………………(34) 　　1 0．五大连池矿泉………………………………(36) 　　1 1．长白温泉……………………………………(40) 　　1 2．兴城温泉……………………………………(44) 　　1 3．汤岗子温泉…………………………………(46) 　　1 4．金州龙眼泉…………………………………(48) 　　1 5．趵突泉………………………………………(52) 　　1 6．黑虎泉………………………………………(56) 　　1 7五龙潭泉………………………………………(57) 　　1 8．珍珠泉(济南)………………………………(58) 　　1 9．崂山矿泉……………………………………(60) 　　20．中泠泉………………………………………(62) 　　21惠山泉…………………………………………(64) 　　22黄山温泉………………………………………(68) 　　2 3．虎跑泉………………………………………(72) 　　24龙井泉…………………………………………(74) 　　25玉泉……………………………………………(76) 　　26．招隐泉………………………………………(78) 　　27．北投温泉……………………………………(80) 　　28．关子岭温泉…………………………………(82) 　　29．百泉…………………………………………(84) 　　30．珍珠泉(安阳)………………………………(86) 　　31．卓刀泉………………………………………(88) 　　32．咸宁温泉……………………………………(90) 　　33．白沙泉………………………………………(92) 　　34．大龙洞泉……………………………………(94) 　　35．从化温泉……………………………………(96) 　　36．中山温泉……………………………………(100) 　　37．三元里矿泉…………………………………(102) 　　38．乳泉…………………………………………(104) 　　39．鹅泉…………………………………………(106) 　　40．华清池………………………………………(108) 　　41．月牙泉………………………………………(112) 　　42．酒泉…………………………………………(114) 　　43．五泉…………………………………………(116) 　　44．贵德矿泉……………………………………(120) 　　45．水磨沟温泉…………………………………(122) 　　46．北温泉………………………………………(124) 　　47．玉妃泉………………………………………(126) 　　48．翡翠泉………………………………………(128) 　　49．药王泉(贡嘎山矿泉)………………………(130) 　　50．三潮泉………………………………………(132) 　　51．安宁温泉……………………………………(134) 　　52．腾冲温泉……………………………………(136) 　　53．蝴蝶泉………………………………………(140) 　　54．搭各加间歇喷泉……………………………(144) 　　56. 可滋泉....................................................（147） 　　中国名泉基本情况一览表……………………… (150)  序言/前言/中国名泉 编辑 			 		　　泉，是地下水的天然露头，是一种水文地质现象。 　　泉遍布我国大陆和海岛，滋润着土地，是许多大江大河的源头。它与人类的繁衍和民族的生存环境息 息相关，是我们生存不可缺少的重要资源。而名泉则 为泉中之佼佼者，因实用、其观赏价值，或因与古迹 名胜同在而名扬遐迩。中国名泉是镶嵌在祖国大地上 的明珠，是中华民族的瑰宝。 　　我们的祖先很早就开发利用泉水，在出土的甲骨 文里，即有关于泉的记载。古老的诗集《诗经》，有 许多美丽的诗句赞美泉水的清澈、甘冽和涌流不息。 更有意义的是在古籍《尔雅》中，列举了相当于上升 泉、下降泉、侵蚀泉、问歇泉、季节性泉等各种各样 的泉，可以说是我国最早的泉的分类。 　　中华人民共和国建立以来，广大地质工作者对分 布在我国各地的泉做了大量调查研究工作，积累了丰 富的实际资料。 　　按照近代的研究，泉可以从地质学角度进行分 类，也可以据物理、化学特征分类。一些富含有益元 素的温泉、矿泉，具有很好的医疗保健价值。由于我 国幅员辽阔，自然环境多姿多态，各地的气候和地质 环境不同，形成了各种类型的泉。它们无论在科学研 究、旅游观赏还是在人民生活、工农业用水以及医疗 等方面的开发利用，都各有重要的实际意义。 　　近年来，随着旅游资源的开拓，我国名泉的观赏、旅游价值及知名度等更非昔日可比。各地有不少旅游点因泉而驰名古今中外，陕西临潼有骊山温泉，唐代便修建了华清宫；山东济南因有趵突、珍珠等72泉，故有泉城盛誉；江苏无锡惠山有“天下第二泉”，遂有一曲《二泉映月》，传向天外。还有许多名胜古迹，因有泉水而格外增辉，杭州西湖边有龙井泉，庐山东林寺有聪明泉，承德避暑山庄有热河泉，……总之，许多好去处大多有泉出露，所以泉也是一种宝贵的旅游资源。 　　随着改革的不断深化和对外开放的进一步扩大，随着社会主义现代化建设事业日益兴旺发达和人民生活水平不断提高，人民群众越来越多地希望了解我国名泉的情况，以至亲身去名泉观赏旅游。为了满足国内外广大旅游者的需要，将我国的部分大泉、名泉资料收集、整理，编辑出版，是非常必要的。它将会激励我们对祖国山河的热爱，促进全社会对保护自然地质环境的重视，同时对发展地质旅游以至整个旅游事业，扩大环境地质信息的国际交流，也会起到积极作用。 　　值此《中国名泉》出版之际，谨以此为序。
张星显,专家##学者##茶##茶叶##茶学,张星显，男，汉族，1963年9月出生，中共党员，茶学专业高级农艺师，硕士研究生。现任汉中市茶业协会副会长、汉中市茶产业发展协调指导委员会办公室副主任，汉中市农技中心开发部主任、（兼）市茶技站副站长。
宗祖薄片,茶学##茶文化##黑茶,宗祖薄片又名张良薄片、渠江薄片，相传为家启蒙者西汉名臣张良所造，其产地为湖南省安化县渠江镇一带，传承至今已有2300多年，是安化黑茶之祖。
云台山云雾茶,茶学,云台山云雾茶又名连云港云雾茶，是中国传统名茶，产自江苏省连云港市云台山一带。由汉族茶农创制于宋代。以其色、香、味、形俱佳而跻身于太湖碧螺春、南京雨花等名茶之列。古时候悟正庵的僧人每年精心采制，只得二、三斤，秘不示人，视作珍茗，招待贵宾。具有“味醇、色秀、香馨、液清”而驰名遐迩。清海州知州唐仲冕也把它当作茶王“龙团风饼。”
古韵茗家,茶叶##茶学文献##茶文化##茶道,此词条暂无内容，欢迎您参与编辑，享受分享贡献知识的乐趣。建议您在编辑词条之前，可先参考帮助中心文档，了解更多关于词条规范的信息。同时也可先熟悉编辑器的使用。若有疑问，欢迎联系： 在线提问：帮助小组联系我们友情提示：编写内容之前需删除以上内容。
湖州老茶,人物##博客##网络人物##茶学文献##茶文化,一、 湖州老茶，浙江湖州一个茶文化研究者的网名。他因从1961年分配至湖州工作，如今已经定居48年(其间居南浔18年，居湖州30年），是老湖州。自1951年进入杭州农业学校读茶科，1954年毕业，曾任茶叶干部，钱时霖、竺济法编的《中华茶人诗描》有收录。现与陆羽茶文化研究会同仁及湖州市、县茶人友好，同敬茶圣，同修茶学，同学茶事，同游茶地，同考茶迹，同研茶史，同读茶文，同吟茶诗，同说茶人，同享茶福，…………由于年届古稀，自谓“湖州老茶”。         二、湖州老茶，维客空间。         三\湖州老茶的博客：http://liguangde001.blog.sohu.com/
茶学说,文化##植物学##茶学文献##茶道,茶学说是茶道这一普遍概念下的子概念，它是茶道的六大外延之一。 　　茶学说是自然科学的一部分，它是反映人类研究一切茶叶、茶树的物质属性和研究如何认识茶叶、茶树的方法论。作为茶道的方法论中不可割裂的一部分，它是指有修行的茶人提出的，成体系的以茶叶、茶树为中心主题的学术观点，是用语言、文字表述、记载的文章或书籍。
千岛春露,茶##茶学文献,千岛春露，是新洲茗园力推一款茶品，由浙江新洲国际贸易有限公司下属淳安新洲制茶有限公司等基地生产，主产于美丽的千岛湖畔的鸠坑茶区。
《试院煎茶》,茶学文献,《试院煎茶》是宋代诗人苏轼的作品之一。
榕江茶,山茶属##山茶科##植物##生物##自然##茶学文献,产云南河口、广西大苗山等地常绿林，海拔1 000米山地。
《说茶饮茶》,茶学文献,说茶饮茶 内容简介本书是由中国农业科学院茶叶研究所俞永明研究员等编著的一部关于茶学知识的科普读物。内容包括：茶的历史沿革、茶类和名茶、茶的营养和药用成分、茶叶品质的识别、茶的贮存和保鲜、茶的品级规格及各地名优茶要览。本书涉及茶的方方面面，信息量大，知识丰富，具有很强的科学性、实用性、趣味性，并有浓郁的茶文化韵味。本书可供茶叶生产者、经营堵塞和广大茶叶消费者及茶文化爱好者阅读。 说茶饮茶 本书目录前言一、茶的历史沿革二、茶类和名茶三、茶的营养和药用成分四、茶叶品质的识别五、茶的贮存和保鲜六、茶的冲泡七、饮茶与健康八、饮茶习俗附录1.各类茶的品级规格附录2.各省区名优茶要览
小瘤果茶,山茶属##山茶科##植物##生物##自然##茶学文献,小瘤果茶是一种植物，产自贵州赤水金沙的沙田。小乔木，嫩枝无毛，干后有光泽。叶薄革质，狭披针形，长7-11厘米，宽2-2.5厘米，先端尾状渐尖，基部阔楔形或近圆形，上面深绿色，暗晦或稍发亮，下面黄绿色，无毛，侧脉每边7-9条，在上面明显，在下面能见，网脉在上下两面均不明显，全缘，叶柄长约1厘米。花顶生，无柄。
长凸连蕊茶,山茶属##山茶科##植物##生物##自然##茶学文献,长凸连蕊茶，小乔木，高4米，嫩枝纤细，无毛。分布于广西融水县泗涧山。形态特征：叶薄革质，长圆形，长9-11厘米，宽3-4厘米，先端尾状渐尖，尾部长2厘米，基部楔形，上面绿色，发亮，下面无毛，侧脉7-8对，不明显，边缘有细锯齿，叶柄长5-7毫米。蒴果单生于枝顶，果柄长7-8毫米；苞片4片，细小卵形，长0.5-1毫米，宿存；萼片5片，长约4毫米，下半部连生，无毛，先端圆形；蒴果卵形，长1.4厘米，宽1厘米，无毛，果爿薄，1室，种子1个，球形。果期8-9月。
河南省茶文化研究会,协会##组织##茶学文献,河南省茶文化研究会2007年2月23日于郑州成立，是由茶学界、茶经济界和茶文化界人士发起并自愿组成的，不以营利为目的的全省性、学术性民间组织，经政府主管部门批准登记注册。属独立的社会团体法人。
泡茶师,茶学文献,Tea maker	 	专司泡茶技艺的人员。起于中国台湾省。20世纪80年代，台湾一家茶业企业首次举办泡茶员培训班，结业后给每位学员颁发资格证书。后来，台湾陆羽茶艺中心把这种培训班固定在每年5月举办，并进行严格的“泡茶师检定考试”，内容分学科和术科两大类。学科为一般茶学常识，术科则要进行泡三种茶的技术考核，两项科目均通过后发给“泡茶师证书”。	 .................................. 参考《中国茶叶大辞典》 www.chichaqu.com
